{
  "$schema": "./registry.schema.json",
  "registry": "elyra-skills",
  "version": "1",
  "source": {
    "type": "git",
    "url": "https://github.com/kwhorne/elyra-skills",
    "branch": "main"
  },
  "docs": "https://elyracode.com",
  "skills": [
    {
      "name": "code-review",
      "description": "Perform a structured code review with severity-tagged feedback. Use when the user asks for a code review, PR feedback, evaluating a diff before merge, or wants a second opinion on a change.",
      "path": "skills/code-review",
      "tags": [
        "review",
        "quality"
      ],
      "version": "1.0.0",
      "author": "elyra-skills"
    },
    {
      "name": "conventional-commits",
      "description": "Generate Conventional Commits messages from staged changes. Use when the user asks to write a commit message, follow Conventional Commits, summarize staged changes, or prepare a commit.",
      "path": "skills/conventional-commits",
      "tags": [
        "git",
        "commits",
        "conventions"
      ],
      "version": "1.0.0",
      "author": "elyra-skills"
    },
    {
      "name": "debugging",
      "description": "Systematically debug a problem - reproduce, isolate, fix, verify, prevent regression. Use when the user reports a bug, an unexpected error, a failing test, or asks to investigate why something is broken.",
      "path": "skills/debugging",
      "tags": [
        "debugging",
        "troubleshooting"
      ],
      "version": "1.0.0",
      "author": "elyra-skills"
    },
    {
      "name": "pr-description",
      "description": "Write a clear, scannable pull request description from a diff or branch. Use when the user asks to draft a PR description, summarize a branch, prepare a change for review, or fill out a PR template.",
      "path": "skills/pr-description",
      "tags": [
        "git",
        "pr",
        "review"
      ],
      "version": "1.0.0",
      "author": "elyra-skills"
    },
    {
      "name": "refactoring",
      "description": "Refactor code safely with characterization tests first, small reversible steps, and verification after each step. Use when the user asks to refactor, restructure, clean up, simplify, extract, or rename existing code.",
      "path": "skills/refactoring",
      "tags": [
        "refactoring",
        "quality"
      ],
      "version": "1.0.0",
      "author": "elyra-skills"
    },
    {
      "name": "test-writing",
      "description": "Decide what to test, structure tests with arrange/act/assert, and avoid common pitfalls. Use when the user asks to write, add, or improve tests for existing code, or wants test coverage for a new feature.",
      "path": "skills/test-writing",
      "tags": [
        "testing",
        "quality"
      ],
      "version": "1.0.0",
      "author": "elyra-skills"
    },
    {
      "name": "api-design",
      "description": "Design consistent HTTP/REST endpoints with sensible naming, status codes, pagination, error formats, and versioning. Use when the user asks to design, review, or extend an HTTP API, or wants feedback on endpoint shape.",
      "path": "skills/api-design",
      "tags": [
        "api",
        "rest",
        "design"
      ],
      "version": "1.0.0",
      "author": "elyra-skills"
    },
    {
      "name": "security-audit",
      "description": "Perform an OWASP-flavored security review focused on input handling, authentication, authorization, secrets, and dependencies. Use when the user asks for a security audit, threat review, vulnerability check, or wants to harden code before release.",
      "path": "skills/security-audit",
      "tags": [
        "security",
        "review",
        "owasp"
      ],
      "version": "1.0.0",
      "author": "elyra-skills"
    },
    {
      "name": "accessibility-review",
      "description": "Perform a WCAG-flavored accessibility review of UI code or markup. Use when the user asks for an a11y review, accessibility audit, WCAG check, or wants to make a component/page usable for assistive tech.",
      "path": "skills/accessibility-review",
      "tags": [
        "accessibility",
        "a11y",
        "wcag",
        "review"
      ],
      "version": "1.0.0",
      "author": "elyra-skills"
    },
    {
      "name": "performance-budget",
      "description": "Define and enforce performance budgets for web apps - bundle size, Core Web Vitals, render time, API latency. Use when the user asks to set perf budgets, review performance, investigate slowness, or set up performance gates in CI.",
      "path": "skills/performance-budget",
      "tags": [
        "performance",
        "budgets",
        "web-vitals"
      ],
      "version": "1.0.0",
      "author": "elyra-skills"
    },
    {
      "name": "changelog",
      "description": "Maintain a CHANGELOG.md following the Keep a Changelog format with semver. Use when the user asks to update the changelog, add release notes, prepare a release, or generate changelog entries from commits or merged PRs.",
      "path": "skills/changelog",
      "tags": [
        "changelog",
        "release",
        "semver"
      ],
      "version": "1.0.0",
      "author": "elyra-skills"
    },
    {
      "name": "dependency-update",
      "description": "Safely update project dependencies - assess risk, batch by risk level, verify with tests, and produce a clean changelog. Use when the user asks to update dependencies, bump packages, audit outdated deps, or handle a security advisory.",
      "path": "skills/dependency-update",
      "tags": [
        "dependencies",
        "maintenance",
        "security"
      ],
      "version": "1.0.0",
      "author": "elyra-skills"
    },
    {
      "name": "i18n-review",
      "description": "Audit code and UI for internationalization correctness - string extraction, pluralization, dates/numbers/currencies, RTL support, and locale-aware sorting. Use when the user asks for an i18n review, localization audit, or wants to make an app translation-ready.",
      "path": "skills/i18n-review",
      "tags": [
        "i18n",
        "l10n",
        "localization",
        "review"
      ],
      "version": "1.0.0",
      "author": "elyra-skills"
    },
    {
      "name": "incident-response",
      "description": "Work through a production incident calmly - triage severity, mitigate first, communicate clearly, then root-cause and document. Use when the user reports prod is down, an outage is in progress, a degraded service, or asks for help during/after an incident.",
      "path": "skills/incident-response",
      "tags": [
        "incident",
        "sre",
        "ops",
        "postmortem"
      ],
      "version": "1.0.0",
      "author": "elyra-skills"
    },
    {
      "name": "feature-flag-rollout",
      "description": "Plan and execute a safe feature rollout using flags - design the flag, ramp gradually, monitor, and clean up. Use when the user asks about feature flags, gradual rollout, dark launches, kill switches, canary releases, or A/B test plumbing.",
      "path": "skills/feature-flag-rollout",
      "tags": [
        "feature-flags",
        "rollout",
        "deployment"
      ],
      "version": "1.0.0",
      "author": "elyra-skills"
    },
    {
      "name": "release-checklist",
      "description": "Run through a structured pre-release, release, and post-release checklist to ship safely. Use when the user asks to prepare a release, cut a version, deploy to production, or wants a checklist for shipping software.",
      "path": "skills/release-checklist",
      "tags": [
        "release",
        "deployment",
        "checklist"
      ],
      "version": "1.0.0",
      "author": "elyra-skills"
    },
    {
      "name": "database-migration",
      "description": "Plan and write safe database schema migrations using the expand/contract pattern with zero-downtime in mind, lock awareness, and rollback plans. Use when the user asks to add a migration, change schema, alter a table, or migrate data.",
      "path": "skills/database-migration",
      "tags": [
        "database",
        "migration",
        "schema",
        "zero-downtime"
      ],
      "version": "1.0.0",
      "author": "elyra-skills"
    },
    {
      "name": "observability",
      "description": "Decide what to instrument with logs, metrics, and traces so a system is debuggable in production. Use when the user asks about observability, monitoring, logging, metrics, tracing, alerts, or how to make a service debuggable.",
      "path": "skills/observability",
      "tags": [
        "observability",
        "monitoring",
        "logging",
        "metrics",
        "tracing"
      ],
      "version": "1.0.0",
      "author": "elyra-skills"
    },
    {
      "name": "code-style-guide",
      "description": "Establish, document, and enforce a code style guide for a codebase - naming, structure, formatting, lints. Use when the user asks to set up a style guide, define coding conventions, configure linters/formatters, or enforce consistency across a team.",
      "path": "skills/code-style-guide",
      "tags": [
        "style",
        "conventions",
        "linting",
        "formatting"
      ],
      "version": "1.0.0",
      "author": "elyra-skills"
    },
    {
      "name": "architecture-review",
      "description": "Evaluate a system or component design against non-functional requirements - scalability, reliability, maintainability, security, cost. Use when the user asks for an architecture review, design critique, system review, or wants to evaluate a proposed design or ADR before commit.",
      "path": "skills/architecture-review",
      "tags": [
        "architecture",
        "design",
        "review",
        "adr"
      ],
      "version": "1.0.0",
      "author": "elyra-skills"
    },
    {
      "name": "data-privacy-review",